### ISSUE TITLE
Losing packets upon large data transfers when data-seq is enabled server side

### ISSUE THREAD

**Issue by landryb** [xelerance/xl2tpd#133]
Similar to #54, using xl2tpd 1.3.9 on OpenBSD on top of isakmpd, connecting to npppd/isakmpd on OpenBSD 5.7, tunnel is fine/stable as long as i only send 'small' pkts through it (ping, ssh, rsync, etc..) - MTU/MRU is set at 1360 - but web traffic immediately blows, using `curl -o /dev/null http://somewhereontheotherside/2mbtestfile` to reproduce reliably. Serverside, mppe is disabled, and l2tp-data-use-seq is the default (ie 'yes').

Added some debugging code to print pkts and expected sequence numbers, it seems at some point the network receiving thread has a race condition or trips on the first 'large' pkt:
```

expand_payload: payload, cid = 30952, Ns = 32, Nr = 65535                                            
network_thread: recv packet from public.server.ip, size = 80, tunnel = 57452, call = 26093 ref=0 refhim=0                                                                                                                                         
expand_payload: payload, cid = 30952, Ns = 33, Nr = 65535                                            
network_thread: recv packet from public.server.ip, size = 1376, tunnel = 57452, call = 26093 ref=0 refhim=0                                                                                                                                       
expand_payload: payload, cid = 30952, Ns = 34, Nr = 65535                                            
expand_payload: Oops, lost a packet or two (got 34, expected 33).  continuing...                     
network_thread: recv packet from public.server.ip, size = 1376, tunnel = 57452, call = 26093 ref=0 refhim=0                                                                                                                                       
expand_payload: payload, cid = 30952, Ns = 35, Nr = 65535                                            
network_thread: recv packet from public.server.ip, size = 1376, tunnel = 57452, call = 26093 ref=0 refhim=0
expand_payload: payload, cid = 30952, Ns = 36, Nr = 65535
network_thread: recv packet from public.server.ip, size = 1376, tunnel = 57452, call = 26093 ref=0 refhim=0
expand_payload: payload, cid = 30952, Ns = 37, Nr = 65535
network_thread: recv packet from public.server.ip, size = 1376, tunnel = 57452, call = 26093 ref=0 refhim=0
expand_payload: payload, cid = 30952, Ns = 38, Nr = 65535
expand_payload: Oops, lost a packet or two (got 38, expected 37).  continuing...
network_thread: recv packet from public.server.ip, size = 1376, tunnel = 57452, call = 26093 ref=0 refhim=0
expand_payload: payload, cid = 30952, Ns = 39, Nr = 65535
expand_payload: Oops, lost a packet or two (got 39, expected 38).  continuing...
network_thread: recv packet from public.server.ip, size = 1376, tunnel = 57452, call = 26093 ref=0 refhim=0
expand_payload: payload, cid = 30952, Ns = 40, Nr = 65535
````
and after a while the server completely loses track , hits PAYLOAD_FUDGE limit (ie we tolerate only 2 missing pkts), returns EINVAL and gives up:

```
expand_payload: payload, cid = 30952, Ns = 1022, Nr = 65535                                          
expand_payload: Oops, lost a packet or two (got 1022, expected 1021).  continuing...                 
network_thread: recv packet from public.server.ip, size = 1376, tunnel = 57452, call = 26093 ref=0 refhim=0                                                                                                                                       
expand_payload: payload, cid = 30952, Ns = 1026, Nr = 65535                                          
expand_payload: Received out of order payload packet (got 1026, expected 1022)                       
handle_packet: unable to expand payload!                                                             
network_thread: bad packet                                                                           
network_thread: recv packet from public.server.ip, size = 1376, tunnel = 57452, call = 26093 ref=0 refhim=0                                                                                                                                       
expand_payload: payload, cid = 30952, Ns = 1028, Nr = 65535
expand_payload: Received out of order payload packet (got 1028, expected 1022)
handle_packet: unable to expand payload!

```

Looking at tcpdump output, i see all the pkts on the L2TP layer:
```
doas tcpdump -ne -t -v -i em0 port l2tp

server:mac client:mac 0800 142: public.server.ip.1701 > client.ip.1701: l2tp:[LS](57452/26093)Ns=31,Nr=65535[hdlc|][|l2tp] (ttl 243, id 42025, len 128)                                                
server:mac client:mac 0800 142: public.server.ip.1701 > client.ip.1701: l2tp:[LS](57452/26093)Ns=32,Nr=65535[hdlc|][|l2tp] (ttl 243, id 9067, len 128)
server:mac client:mac 0800 122: public.server.ip.1701 > client.ip.1701: l2tp:[LS](57452/26093)Ns=33,Nr=65535[hdlc|][|l2tp] (ttl 243, id 62956, len 108)
server:mac client:mac 0800 1418: public.server.ip.1701 > client.ip.1701: l2tp:[LS](57452/26093)Ns=34,Nr=65535[hdlc|][|l2tp]  (ttl 243, id 31661, len 1404)
server:mac client:mac 0800 1418: public.server.ip.1701 > client.ip.1701: l2tp:[LS](57452/26093)Ns=35,Nr=65535[hdlc|][|l2tp]  (ttl 243, id 448, len 1404)
server:mac client:mac 0800 1418: public.server.ip.1701 > client.ip.1701: l2tp:[LS](57452/26093)Ns=36,Nr=65535[hdlc|][|l2tp]  (ttl 243, id 21059, len 1404)
server:mac client:mac 0800 1418: public.server.ip.1701 > client.ip.1701: l2tp:[LS](57452/26093)Ns=37,Nr=65535[hdlc|][|l2tp]  (ttl 243, id 29904, len 1404)
```
Notice packet 34 is the *first* large one. If i look at the encapsulated http trafic, all packets seems to be here and correct 
```
$doas tcpdump -ne -t -v -i ppp0 host vpn.target.ip and port 80
tcpdump: listening on ppp0, link-type PPP
IP: vpn.client.ip.5341 > vpn.target.ip.80: S [tcp sum ok] 2461547974:2461547974(0) win 16384 <mss 1320,nop,nop,sackOK,nop,wscale 6,nop,nop,timestamp 3407378296 0> (DF) (ttl 64, id 65205, len 64)   
IP: vpn.target.ip.80 > vpn.client.ip.5341: S [tcp sum ok] 192120057:192120057(0) ack 2461547975 win 16384 <mss 1460,nop,nop,sackOK,nop,nop,timestamp 3261195410 3407378296> (DF) (ttl 63, id 48163, len 64)                                                                
IP: vpn.client.ip.5341 > vpn.target.ip.80: . [tcp sum ok] ack 1 win 256 <nop,nop,timestamp 3407378296 3261195410> (DF) (ttl 64, id 22284, len  52)                                           
IP: vpn.client.ip.5341 > vpn.target.ip.80: P 1:80(79) ack 1 win 256 <nop,nop,timestamp 3407378296 3261195410> (DF) (ttl 64, id 22450, len 131 )                                              
IP: vpn.target.ip.80 > vpn.client.ip.5341: . 1:1309(1308) ack 80 win 265 <nop,nop,timestamp 3261195410 3407378296> (DF) (ttl 63, id 27739, len 1360)                                        
IP: vpn.target.ip.80 > vpn.client.ip.5341: . 1309:2617(1308) ack 80 win 265 <nop,nop,timestamp 3261195410 3407378296> (DF) (ttl 63, id 45341, len 1360)                                     
IP: vpn.client.ip.5341 > vpn.target.ip.80: . [tcp sum ok] ack 2617 win 235 <nop,nop,timestamp 3407378297 3261195410> (DF) (ttl 64, id 31547, len 52)                                        
IP: vpn.target.ip.80 > vpn.client.ip.5341: . 2617:3925(1308) ack 80 win 265 <nop,nop,timestamp 3261195410 3407378296> (DF) (ttl 63, id 34973, len 1360)                                     
IP: vpn.client.ip.5341 > vpn.target.ip.80: . [tcp sum ok] ack 3925 win 256 <nop,nop,timestamp 3407378297 3261195410> (DF) (ttl 64, id 38205, len 52)                                        
IP: vpn.target.ip.80 > vpn.client.ip.5341: . 3925:5233(1308) ack 80 win 265 <nop,nop,timestamp 3261195410 3407378296> (DF) (ttl 63, id 41806, len 1360)
IP: vpn.target.ip.80 > vpn.client.ip.5341: . 5233:6541(1308) ack 80 win 265 <nop,nop,timestamp 3261195410 3407378296> (DF) (ttl 63, id 47387, len 1360)
IP: vpn.client.ip.5341 > vpn.target.ip.80: . [tcp sum ok] ack 6541 win 235 <nop,nop,timestamp 3407378297 3261195410> (DF) (ttl 64, id 40225,len 52)
IP: vpn.target.ip.80 > vpn.client.ip.5341: . 6541:7849(1308) ack 80 win 265 <nop,nop,timestamp 3261195410 3407378296> (DF) (ttl 63, id 25759,  len 1360)                                                                                                                                 
IP: vpn.client.ip.5341 > vpn.target.ip.80: . [tcp sum ok] ack 7849 win 256 <nop,nop,timestamp 3407378297 3261195410> (DF) (ttl 64, id 30781, len 52)
IP: vpn.target.ip.80 > vpn.client.ip.5341: . 7849:9157(1308) ack 80 win 265 <nop,nop,timestamp 3261195410 3407378296> (DF) (ttl 63, id 36988, len 1360)
IP: vpn.target.ip.80 > vpn.client.ip.5341: . 9157:10465(1308) ack 80 win 265 <nop,nop,timestamp 3261195410 3407378296> (DF) (ttl 63, id 45479, len 1360)
IP: vpn.client.ip.5341 > vpn.target.ip.80: . [tcp sum ok] ack 10465 win 235 <nop,nop,timestamp 3407378297 3261195410> (DF) (ttl 64, id 35773, len 52)
```

I'll try to see if our network admin can try disabling data-seq on the server, but it seems to me that xl2tpd is behaving wrong here.

**Comment by landryb** [comment]
I can also trigger the 'first large pkt being loss' using ping -s 50000 over the tunnel. It's not an MTU/MRU issue since the whole icmp echo/reply goes through the tunnel and is correctly fragmented....

**Comment by landryb** [comment]
And if i disable sequence number checking (yeah i know, bad) here: https://github.com/xelerance/xl2tpd/blob/master/control.c#L1506

```
-    if (new_hdr->Ns != c->data_seq_num)                             
+    if (0)                       
```

The tunnel is usable, i can send 'big' http transfers through it, ping keeps running, and xl2tpd doesnt blow.

**Comment by landryb** [comment]
And fwiw forcing 
```
flow bit = no
```
in my lac configuration doesnt disable flow control.
```
Jul 13 16:17:00 renton xl2tpd[16866]: parse_config: field is flow bit, value is no
Jul 13 16:17:00 renton xl2tpd[16866]: set_flow bit: flow bit  flag to 'no'
Jul 13 16:17:00 renton xl2tpd[58489]: receive_window_size_avp: peer wants RWS of 4.  Will use flow control.
```
