### ISSUE TITLE
Dual Interface configuration, XL2TP responding only from first interface

### ISSUE THREAD

**Issue by jsommerville-untangle** [xelerance/xl2tpd#198]
Hello, I'm troubleshooting an issue where in a dual interface configuration, XL2TP is only responding from the first interface.  Manually setting the listen-addr to the second interface address works, but the first interface no longer responds (as expected).  IPsec tunnels are not having any issue connecting on the second interface, only L2TP connections. On Xl2TPD 1.3.8 (Debian stretch) this issue didn't occur. Is there additional configuration to allow the UDP packets to respond from the proper interface they were received on?
```
Debian Buster
Linux debian-client 4.19.0-9-amd64 #1 SMP Debian 4.19.118-2+deb10u1 (2020-06-07) x86_64 GNU/Linux

xl2tpd version:  xl2tpd-1.3.12

Linux strongSwan U5.7.2/K4.19.0-8-amd64
University of Applied Sciences Rapperswil, Switzerland
See 'ipsec --copyright' for copyright information.
```

**/etc/ipsec.conf**
```
config setup
	uniqueids=yes

conn VPN-L2TP-0
	keyexchange=ikev1
	authby=psk
	auto=add
	keyingtries=3
	rekey=no
	dpddelay=10
	dpdtimeout=90
	dpdaction=clear
	type=transport
	left=10.11.12.246
	leftprotoport=17/1701
	right=%any
	rightprotoport=17/%any
	ike=3des-md5-modp2048,3des-md5-modp1536,3des-md5-modp1024,3des-sha1-modp2048,3des-sha1-modp1536,3des-sha1-modp1024,aes128-md5-modp2048,aes128-md5-modp1536,aes128-md5-modp1024,aes128-sha1-modp2048,aes128-sha1-modp1536,aes128-sha1-modp1024,aes256-md5-modp2048,aes256-md5-modp1536,aes256-md5-modp1024,aes256-sha1-modp2048,aes256-sha1-modp1536,aes256-sha1-modp1024
	ikelifetime=8h
	esp=3des-md5-modp2048,3des-md5-modp1536,3des-md5-modp1024,3des-sha1-modp2048,3des-sha1-modp1536,3des-sha1-modp1024,aes128-md5-modp2048,aes128-md5-modp1536,aes128-md5-modp1024,aes128-sha1-modp2048,aes128-sha1-modp1536,aes128-sha1-modp1024,aes256-md5-modp2048,aes256-md5-modp1536,aes256-md5-modp1024,aes256-sha1-modp2048,aes256-sha1-modp1536,aes256-sha1-modp1024
	lifetime=1h

conn VPN-L2TP-1
	keyexchange=ikev1
	authby=psk
	auto=add
	keyingtries=3
	rekey=no
	dpddelay=10
	dpdtimeout=90
	dpdaction=clear
	type=transport
	left=10.11.12.249
	leftprotoport=17/1701
	right=%any
	rightprotoport=17/%any
	ike=3des-md5-modp2048,3des-md5-modp1536,3des-md5-modp1024,3des-sha1-modp2048,3des-sha1-modp1536,3des-sha1-modp1024,aes128-md5-modp2048,aes128-md5-modp1536,aes128-md5-modp1024,aes128-sha1-modp2048,aes128-sha1-modp1536,aes128-sha1-modp1024,aes256-md5-modp2048,aes256-md5-modp1536,aes256-md5-modp1024,aes256-sha1-modp2048,aes256-sha1-modp1536,aes256-sha1-modp1024
	ikelifetime=8h
	esp=3des-md5-modp2048,3des-md5-modp1536,3des-md5-modp1024,3des-sha1-modp2048,3des-sha1-modp1536,3des-sha1-modp1024,aes128-md5-modp2048,aes128-md5-modp1536,aes128-md5-modp1024,aes128-sha1-modp2048,aes128-sha1-modp1536,aes128-sha1-modp1024,aes256-md5-modp2048,aes256-md5-modp1536,aes256-md5-modp1024,aes256-sha1-modp2048,aes256-sha1-modp1536,aes256-sha1-modp1024
	lifetime=1h
```

**/etc/xl2tpd/xl2tpd.conf**

```
[global]
	listen-addr = 0.0.0.0
	ipsec saref = no
	port = 1701
	debug network = yes
	debug packet = yes
	debug tunnel = yes
	debug state = yes
	debug avp = yes

[lns default]
	ip range = 10.160.0.2 - 10.160.255.254
	local ip = 10.160.0.1
	assign ip = yes
	require authentication = yes
	name = l2tp
	pppoptfile = /etc/ppp/options.xl2tpd
	hidden bit = yes
	length bit = yes
	ppp debug = yes
```

**/etc/ppp/options.xl2tpd**

```
lock
auth
lcp-echo-failure 30
lcp-echo-interval 4
ipparam L2TP
mtu 1200
mru 1200
noproxyarp
noktune
noipv6
nomppe
local
```

**tcpdump -n -i eth0 host 10.11.12.196**

Notice how after client (196) requests tunnel on (246), the l2tp response happens from (249)

```
11:04:24.332266 IP 10.11.12.196 > 10.11.12.246: ESP(spi=0xc0e1a708,seq=0x1), length 164
11:04:24.334060 IP 10.11.12.196.500 > 10.11.12.246.500: isakmp: phase 2/others I oakley-quick[E]
11:04:24.361637 IP 10.11.12.249.1701 > 10.11.12.196.1701:  l2tp:[TLS](51/0)Ns=0,Nr=1 *MSGTYPE(SCCRP) *RANDOM_VECTOR(2132139e6369d8f9e61fcdac1048cc30) *PROTO_VER(1.0) *FRAMING_CAP(AS) *BEARER_CAP() FIRM_VER(1680) *HOST_NAME(test.example.com) VENDOR_NAME(xelerance.com) *ASSND_TUN_ID(23169) *RECV_WIN_SIZE(4)
11:04:25.038311 ARP, Request who-has 10.11.12.246 (08:00:27:b2:1a:5f) tell 10.11.12.196, length 46
11:04:25.038473 ARP, Reply 10.11.12.246 is-at 08:00:27:b2:1a:5f, length 46
11:04:25.326293 IP 10.11.12.196 > 10.11.12.246: ESP(spi=0xc0e1a708,seq=0x2), length 164
11:04:25.326917 IP 10.11.12.249.1701 > 10.11.12.196.1701:  l2tp:[TLS](52/0)Ns=0,Nr=1 *MSGTYPE(SCCRP) *RANDOM_VECTOR(1e8863bfad801b5db2f71c8fc15b7a2e) *PROTO_VER(1.0) *FRAMING_CAP(AS) *BEARER_CAP() FIRM_VER(1680) *HOST_NAME(test.example.com) VENDOR_NAME(xelerance.com) *ASSND_TUN_ID(44628) *RECV_WIN_SIZE(4)
```

**Comment by jsommerville-untangle** [comment]
I can confirm the issue started with cc909bbb 

Xl2tp Log with commit prior to cc909bbb:

`git checkout c90c070`

```
Jul 16 16:03:32 test xl2tpd[10695]: Connection established to 10.11.12.196, 1701.  Local: 42, Remote: 13 (ref=0/0).  LNS session is 'default'
Jul 16 16:03:32 test xl2tpd[10695]: check_control: Received out of order control packet on tunnel 13 (got 3, expected 2)
Jul 16 16:03:32 test xl2tpd[10695]: handle_packet: bad control packet!
Jul 16 16:03:32 test xl2tpd[10695]: start_pppd: I'm running: 
Jul 16 16:03:32 test xl2tpd[10695]: "/usr/sbin/pppd" 
Jul 16 16:03:32 test xl2tpd[10695]: "/dev/pts/3" 
Jul 16 16:03:32 test xl2tpd[10695]: "passive" 
Jul 16 16:03:32 test xl2tpd[10695]: "nodetach" 
Jul 16 16:03:32 test xl2tpd[10695]: "10.160.0.1:10.160.0.2" 
Jul 16 16:03:32 test xl2tpd[10695]: "auth" 
Jul 16 16:03:32 test xl2tpd[10695]: "name" 
Jul 16 16:03:32 test xl2tpd[10695]: "test-l2tp" 
Jul 16 16:03:32 test xl2tpd[10695]: "file" 
Jul 16 16:03:32 test xl2tpd[10695]: "/etc/ppp/options.xl2tpd" 
Jul 16 16:03:32 test xl2tpd[10695]: Call established with 10.11.12.196, PID: 11376, Local: 5170, Remote: 1, Serial: 0
Jul 16 16:03:37 test xl2tpd[10695]: control_finish: Connection closed to 10.11.12.196, serial 0 ()
Jul 16 16:03:37 test xl2tpd[10695]: Terminating pppd: sending TERM signal to pid 11376
Jul 16 16:03:37 test xl2tpd[10695]: control_finish: Connection closed to 10.11.12.196, port 1701 (), Local: 42, Remote: 13
```

`git checkout ccc909bb && make && make install && service xl2tp restart`


```
Jul 16 16:03:45 test xl2tpd[10695]: death_handler: Fatal signal 15 received
Jul 16 16:03:45 test xl2tpd[11462]: Stopping xl2tpd: xl2tpd.
Jul 16 16:03:45 test xl2tpd[11471]: IPsec SAref does not work with L2TP kernel mode yet, enabling force userspace=yes
Jul 16 16:03:45 test xl2tpd[11471]: Not looking for kernel SAref support.
Jul 16 16:03:45 test xl2tpd[11471]: Not looking for kernel support.
Jul 16 16:03:45 test xl2tpd[11467]: Starting xl2tpd: xl2tpd.
Jul 16 16:03:45 test xl2tpd[11472]: xl2tpd version xl2tpd-1.3.11 started on test.example.com PID:11472
Jul 16 16:03:45 test xl2tpd[11472]: Written by Mark Spencer, Copyright (C) 1998, Adtran, Inc.
Jul 16 16:03:45 test xl2tpd[11472]: Forked by Scott Balmos and David Stipp, (C) 2001
Jul 16 16:03:45 test xl2tpd[11472]: Inherited by Jeff McAdams, (C) 2002
Jul 16 16:03:45 test xl2tpd[11472]: Forked again by Xelerance (www.xelerance.com) (C) 2006-2016
Jul 16 16:03:45 test xl2tpd[11472]: Listening on IP address 0.0.0.0, port 1701
Jul 16 16:03:52 test xl2tpd[11472]: control_finish: Peer requested tunnel 14 twice, ignoring second one.
Jul 16 16:03:56 test xl2tpd[11472]: control_finish: Peer requested tunnel 14 twice, ignoring second one.
Jul 16 16:04:04 test xl2tpd[11472]: control_finish: Peer requested tunnel 14 twice, ignoring second one.
Jul 16 16:04:15 test xl2tpd[11472]: control_finish: Peer requested tunnel 14 twice, ignoring second one.
Jul 16 16:04:21 test xl2tpd[11472]: Maximum retries exceeded for tunnel 7640.  Closing.
Jul 16 16:04:21 test xl2tpd[11472]: Connection 14 closed to 10.11.12.196, port 1701 (Timeout)

**Comment by jsommerville-untangle** [comment]
Can we set the sockopt for IP_PKTINFO even when we are not using SAref support flags?

https://github.com/xelerance/xl2tpd/commit/cc909bbb20d3e6e216c3d11e0f328ff906f289a8#diff-a5c7673145e313c936e4b61f7fbee2ebR95

Moving this out of this else resolves my issue, but may reintroduce ENODEV issue referenced by commit cc909bb

**Comment by jsommerville-untangle** [comment]
Alternatively, setting

```
ipsec saref = yes
force userspace = yes
```

in the xl2tpd.conf file resolves the issue, but only because of the if/else logic referenced above.

**Comment by jsommerville-untangle** [comment]
Small correction to a comment made previously, we have to write the following to enter the else statement to allow setting the socketopt correctly for multi wan interfaces:

```
	ipsec saref = yes
	force userspace = yes
	saref refinfo = 1
```

**Comment by shussain** [comment]
@jsommerville-untangle Thank you for the troubleshooting and suggested chagnes (in code and via configuration)

I am hoping to work on the code change you had suggested (or investigate how to do it without bringing back the ENODEV issue) when I have more time. 

In the meantime I am leaving this issue open so others can see the work around and/or make a PR.

**Comment by jkroonza** [comment]
Without looking into this at all, since by default xl2tpd binds to 0.0.0.0 the source address is selected by the kernel based on routing table (ip ro get ${destination} should reveal what I mean.

There are two workarounds:

1.  Update xl2tpd to upon receipt use recvfrom() and then ensure that sending traffic is sent from the same IP.  I've not managed this yet.

2.  Bind xl2tpd to a specific address (potentially on the loopback, but not 127.0.0.0/8 range) and then use netfilter DNAT to on input send the traffic to the correct IP, this results in the kernel establishing a conntrack entry, and upon egress from xl2tpd the kernel will "undo" the DNAT, resulting in the source address being correct.

Option 2 works for any udp based protocol where this happens (first discovered and worked around on openvpn), and yet another reason to have loopbacks on your systems.  Where possible, just bind xl2tpd to the right address - this is however not always viable (eg, multiple dynamic uplinks, all of which needs to be active).
