### ISSUE TITLE
Serving on two Internet connections.

### ISSUE THREAD

**Issue by alex-eri** [xelerance/xl2tpd#137]
Then I connects on first(default gateway) internet all works as expected.
Then I connects to second address pppd uses default (first) ip.
Packets l2tp:[TLS] are sent properly. But PPP LCP tried with first address.

Tcpdump on server:
```
16:04:36.124214 IP x.x.x.134.1701 > z.z.z.z.9809:  l2tp:[TLS](56620/0)Ns=1,Nr=2 ZLB
16:04:36.124357 IP x.x.x.134.1701 > z.z.z.z.9809:  l2tp:[TLS](56620/49902)Ns=1,Nr=3 *MSGTYPE(ICRP) *ASSND_SESS_ID(11516)
16:04:36.124440 IP x.x.x.134.1701 > z.z.z.z.9809:  l2tp:[TLS](56620/0)Ns=2,Nr=3 ZLB
16:04:36.124536 IP x.x.x.134.1701 > z.z.z.z.9809:  l2tp:[TLS](56620/0)Ns=2,Nr=3 ZLB
16:04:36.124597 IP x.x.x.134.1701 > z.z.z.z.9809:  l2tp:[TLS](56620/0)Ns=2,Nr=3 ZLB
16:04:36.126682 IP z.z.z.z.9809 > x.x.x.134.1701:  l2tp:[TLS](3768/0)Ns=3,Nr=1 ZLB
16:04:36.185226 IP z.z.z.z.9809 > x.x.x.134.1701:  l2tp:[TLS](3768/11516)Ns=3,Nr=2 *MSGTYPE(ICCN) *TX_CONN_SPEED(100000000) *FRAMING_TYPE(S) RX_CONN_SPEED(100000000)
16:04:36.187111 IP x.x.x.134.1701 > z.z.z.z.9809:  l2tp:[TLS](56620/49902)Ns=2,Nr=4 ZLB
16:04:36.196933 IP z.z.z.z.9809 > x.x.x.134.1701:  l2tp:[](3768/11516) {LCP, Conf-Request (0x01), id 1, length 22}
16:04:36.215326 IP y.y.y.231.1701 > z.z.z.z.9809:  l2tp:[](56620/49902) {LCP, Conf-Request (0x01), id 1, length 27}
16:04:39.215438 IP z.z.z.z.9809 > x.x.x.134.1701:  l2tp:[](3768/11516) {LCP, Conf-Request (0x01), id 1, length 22}
16:04:39.216674 IP y.y.y.231.1701 > z.z.z.z.9809:  l2tp:[](56620/49902) {LCP, Conf-Request (0x01), id 1, length 27}
16:04:42.215606 IP z.z.z.z.9809 > x.x.x.134.1701:  l2tp:[](3768/11516) {LCP, Conf-Request (0x01), id 1, length 22}
16:04:42.220181 IP y.y.y.231.1701 > z.z.z.z.9809:  l2tp:[](56620/49902) {LCP, Conf-Request (0x01), id 1, length 27}
16:04:45.223446 IP y.y.y.231.1701 > z.z.z.z.9809:  l2tp:[](56620/49902) {LCP, Conf-Request (0x01), id 1, length 27}

```

z.z.z.z - client. y.y.y.231 - default ip on server, x.x.x.134 - second ip.

I tried to make failover with two links. Without IPSEC, just MPPE. 

PPTP works properly.

**Comment by shussain** [comment]
What version of l2tp are you using?

**Comment by alex-eri** [comment]
@shussain 

Debian Stretch

xl2tpd-1.3.8
Linux 4.9.0-3-686
pppd version 2.4.7


```
[global]
auth file = /etc/xl2tpd/l2tp-secrets
listen-addr = 0.0.0.0

[lns default]
local ip = 192.168.12.2
require authentication = yes
pppoptfile = /etc/ppp/options.xl2tpd
length bit = yes
assign ip = no

```
/etc/ppp/options.xl2tpd 
```
asyncmap 0
auth
idle 600
mtu 1400
mru 1400
hide-password
name l2tpd
proxyarp
lcp-echo-interval 60
lcp-echo-failure 2
require-mschap-v2
refuse-pap
refuse-eap
refuse-chap
refuse-mschap
```

**Comment by alex-eri** [comment]
maybe any workarounds?
